{
  "format_version": 1,
  "data_status": "synthetic",
  "label": "SYNTHETIC data made by tools/make_mock_data.py. Not real client data.",
  "table_file": "experiments_example.csv",
  "source": "the first 12 rows of data/mock/mock_formulation_small.csv",
  "encoding": "utf-8 (no byte-order mark)",
  "line_endings": "LF",
  "contains_real_client_data": false,
  "rows": 12,
  "columns": 21,
  "deliberate_issues": "none: a clean example"
}
